{
  "host_runtimes": [
    {
      "endpoints": [
        "http://localhost:12434",
        "http://model-runner.docker.internal/engines/v1"
      ],
      "healthcheck_validator": "preflight-model",
      "id": "model-runner-host",
      "purpose": "Docker Model Runner on the host, serving embeddings and the reranker. No Compose file declares it, so without this node the embedding and reranker dependency edges are invisible to every graph query."
    }
  ],
  "networks": [
    {
      "internal": true,
      "name": "codecov-internal"
    },
    {
      "internal": true,
      "name": "data-internal"
    },
    {
      "internal": true,
      "name": "sandbox-internal"
    },
    {
      "internal": false,
      "name": "service-egress"
    }
  ],
  "provenance": {
    "extractor_version": "1.0.0",
    "method": "extracted",
    "sources": [
      "Makefile",
      "docker-compose.dev.yml",
      "docker-compose.frontend.yml",
      "docker-compose.prod.yml",
      "docker-compose.yml"
    ]
  },
  "schema_version": 1,
  "services": [
    {
      "build": {
        "args": [],
        "context": "backend",
        "dockerfile": "Dockerfile"
      },
      "depends_on": [
        "db",
        "docling-serve",
        "minio",
        "redis"
      ],
      "env_refs": [
        "DOMAIN",
        "MINIO_ROOT_PASSWORD",
        "MINIO_ROOT_USER",
        "POSTGRES_DB",
        "POSTGRES_PASSWORD",
        "POSTGRES_USER",
        "REDIS_PASSWORD"
      ],
      "expose": [
        "8100"
      ],
      "gpu": false,
      "healthcheck": {
        "present": true
      },
      "image": {
        "ref": "fullstack-backend:local"
      },
      "name": "app",
      "networks": [
        "data-internal",
        "sandbox-internal",
        "service-egress"
      ],
      "ports": [
        {
          "container_port": "8100",
          "host_ip": "127.0.0.1",
          "host_port": "8100",
          "stack": "dev"
        },
        {
          "container_port": "8100",
          "host_ip": "127.0.0.1",
          "host_port": "8100",
          "stack": "frontend"
        }
      ],
      "presence": [
        {
          "active_without_profile": true,
          "profiles": [],
          "stack": "base"
        },
        {
          "active_without_profile": true,
          "profiles": [],
          "stack": "dev"
        },
        {
          "active_without_profile": true,
          "profiles": [],
          "stack": "frontend"
        },
        {
          "active_without_profile": true,
          "profiles": [],
          "stack": "prod"
        }
      ],
      "volumes": [
        {
          "class": "named",
          "name": "media_data",
          "target": "/app/media"
        },
        {
          "class": "named",
          "name": "models_cache",
          "target": "/app/models_cache"
        },
        {
          "class": "bind",
          "name": "./emails",
          "target": "/app/emails"
        }
      ]
    },
    {
      "depends_on": [],
      "env_refs": [
        "BROWSERLESS_TOKEN"
      ],
      "expose": [
        "3000"
      ],
      "gpu": false,
      "healthcheck": {
        "present": false
      },
      "image": {
        "digest": "sha256:07f6561d607b80312cc9b2500e98e40cf1eb0276fb647984fa074c96b9dd41dc",
        "ref": "ghcr.io/browserless/chromium"
      },
      "name": "browserless",
      "networks": [
        "service-egress"
      ],
      "presence": [
        {
          "active_without_profile": false,
          "profiles": [
            "mcp"
          ],
          "stack": "base"
        },
        {
          "active_without_profile": false,
          "profiles": [
            "mcp"
          ],
          "stack": "dev"
        },
        {
          "active_without_profile": false,
          "profiles": [
            "mcp"
          ],
          "stack": "frontend"
        },
        {
          "active_without_profile": false,
          "profiles": [
            "mcp"
          ],
          "stack": "prod"
        }
      ],
      "volumes": []
    },
    {
      "build": {
        "args": [],
        "context": "docker/mcp/chrome-devtools"
      },
      "depends_on": [
        "browserless"
      ],
      "env_refs": [
        "BROWSERLESS_TOKEN"
      ],
      "expose": [
        "8000"
      ],
      "gpu": false,
      "healthcheck": {
        "present": false
      },
      "name": "chrome-devtools-mcp",
      "networks": [
        "service-egress"
      ],
      "ports": [
        {
          "container_port": "8000",
          "host_ip": "127.0.0.1",
          "host_port": "8202",
          "stack": "dev"
        },
        {
          "container_port": "8000",
          "host_ip": "127.0.0.1",
          "host_port": "8202",
          "stack": "frontend"
        }
      ],
      "presence": [
        {
          "active_without_profile": false,
          "profiles": [
            "mcp"
          ],
          "stack": "base"
        },
        {
          "active_without_profile": false,
          "profiles": [
            "mcp"
          ],
          "stack": "dev"
        },
        {
          "active_without_profile": false,
          "profiles": [
            "mcp"
          ],
          "stack": "frontend"
        },
        {
          "active_without_profile": false,
          "profiles": [
            "mcp"
          ],
          "stack": "prod"
        }
      ],
      "volumes": []
    },
    {
      "depends_on": [
        "codecov-minio",
        "codecov-postgres",
        "codecov-redis",
        "codecov-timescale"
      ],
      "env_refs": [
        "CODECOV_COOKIE_SECRET",
        "CODECOV_GITHUB_CLIENT_ID",
        "CODECOV_GITHUB_CLIENT_SECRET",
        "CODECOV_GITHUB_WEBHOOK_SECRET",
        "CODECOV_GLOBAL_UPLOAD_TOKEN",
        "CODECOV_MINIO_ROOT_PASSWORD",
        "CODECOV_MINIO_ROOT_USER",
        "CODECOV_POSTGRES_PASSWORD",
        "DOMAIN"
      ],
      "expose": [
        "8000"
      ],
      "gpu": false,
      "healthcheck": {
        "present": true
      },
      "image": {
        "digest": "sha256:8a163b48d97754872e7602e6c07326880984ecd6a12b3e5db9c3e8c502edf379",
        "ref": "codecov/self-hosted-api:26.5.18"
      },
      "name": "codecov-api",
      "networks": [
        "codecov-internal",
        "service-egress"
      ],
      "presence": [
        {
          "active_without_profile": false,
          "profiles": [
            "codecov"
          ],
          "stack": "base"
        },
        {
          "active_without_profile": false,
          "profiles": [
            "codecov"
          ],
          "stack": "dev"
        },
        {
          "active_without_profile": false,
          "profiles": [
            "codecov"
          ],
          "stack": "frontend"
        },
        {
          "active_without_profile": false,
          "profiles": [
            "codecov"
          ],
          "stack": "prod"
        }
      ],
      "volumes": [
        {
          "class": "bind",
          "name": "./docker/codecov/config",
          "target": "/config"
        }
      ]
    },
    {
      "depends_on": [],
      "env_refs": [
        "DOMAIN"
      ],
      "expose": [
        "8080"
      ],
      "gpu": false,
      "healthcheck": {
        "present": true
      },
      "image": {
        "digest": "sha256:d0177dd141a9709eaf2bf9ff5053a708865a66a1ee2037f416b5607892d25b8c",
        "ref": "codecov/self-hosted-frontend:26.4.1"
      },
      "name": "codecov-frontend",
      "networks": [
        "codecov-internal"
      ],
      "presence": [
        {
          "active_without_profile": false,
          "profiles": [
            "codecov"
          ],
          "stack": "base"
        },
        {
          "active_without_profile": false,
          "profiles": [
            "codecov"
          ],
          "stack": "dev"
        },
        {
          "active_without_profile": false,
          "profiles": [
            "codecov"
          ],
          "stack": "frontend"
        },
        {
          "active_without_profile": false,
          "profiles": [
            "codecov"
          ],
          "stack": "prod"
        }
      ],
      "volumes": [
        {
          "class": "bind",
          "name": "./docker/codecov/config",
          "target": "/config"
        }
      ]
    },
    {
      "depends_on": [
        "codecov-api",
        "codecov-frontend"
      ],
      "env_refs": [
        "DOMAIN"
      ],
      "expose": [
        "8090"
      ],
      "gpu": false,
      "healthcheck": {
        "present": true
      },
      "image": {
        "digest": "sha256:24ec18b65a79658c9e2dfeec6f11cda1fd905f49776e538c706abd02baa786e4",
        "ref": "codecov/self-hosted-gateway:26.4.1"
      },
      "name": "codecov-gateway",
      "networks": [
        "codecov-internal",
        "service-egress"
      ],
      "ports": [
        {
          "container_port": "8090",
          "host_ip": "127.0.0.1",
          "host_port": "8090",
          "stack": "dev"
        },
        {
          "container_port": "8090",
          "host_ip": "127.0.0.1",
          "host_port": "8090",
          "stack": "frontend"
        }
      ],
      "presence": [
        {
          "active_without_profile": false,
          "profiles": [
            "codecov"
          ],
          "stack": "base"
        },
        {
          "active_without_profile": false,
          "profiles": [
            "codecov"
          ],
          "stack": "dev"
        },
        {
          "active_without_profile": false,
          "profiles": [
            "codecov"
          ],
          "stack": "frontend"
        },
        {
          "active_without_profile": false,
          "profiles": [
            "codecov"
          ],
          "stack": "prod"
        }
      ],
      "volumes": [
        {
          "class": "bind",
          "name": "./docker/codecov/config",
          "target": "/config"
        }